	Id	Titulo	Compañia	Lugar	Fecha	Nivel de antigüedad	Tipo de empleo	Función laboral	Sectores	Contenido
30	2274625218	Study Designer, Clinical Data Management	MSD	Buenos Aires, Provincia de Buenos Aires, Argentina	Hace 4 semanas	 Sin experiencia	 Jornada completa	 Investigación Ciencias Consultoría	 Industria farmacéutica Investigación Servicios médicos	"Job Description

Our Clinical Research and Pharmacovigilance team push the boundaries of global healthcare through research and innovation. Through clinical trials and surveillance, we ensure the safety and efficacy of our existing and pipeline products to produce safe, effective, innovative medicine.

In connection with other General Data Management Service (GDMS) roles, the Study Designer (SD) role is accountable for:
Ensuring quality and consistent E2E data management deliverables within a trial and across trials within their assigned TA.
Ensuring the appropriate cross-functional perspectives are incorporated into the trial design and change control processes.

The role is responsible to support Trial design, including new components and updates to existing Library components as per Protocol/Program design requirements and Industry Standards, as well as monitoring and supporting the ongoing change control of data management deliverables for the life of the trial as needed.

The SD will interact with staff across multiple Functional areas and serve in the role of guiding Study Teams in applying global standards and industry best practices into E2E study design.

Primary Activities Include, But Are Not Limited To
Support Study Design activities to ensure complete, comprehensive and high quality E2E design.
Interact with study level resources (e.g. BARDS, Clinical, GDMS, External Vendors) to gather trial requirements (including new/updated components) and assure appropriate integration of all data sources.
Ensures quality and consistency of the E2E data management specifications within and across trials in a Program and/or Therapeutic Area (TA). This may include, but is not limited to:
Authoring data collection specifications for new and updated components.
Including creation, submission and management of the Standards Request Package.
Excluding COA & IRT Vendor Specs.
Review and approval of Trial data collection specifications, including data Integration and data validation specifications.
Support change management, as applicable.
Author new data collection components or significant changes to data collection components.
Review/approve adding additional existing data collection components.
Ensures appropriate use of Global, TA and Industry Standards at the Trial level.
Apply critical assessment, industry knowledge and expertise to make recommendations for efficient and effective data collection/design at Trial level, to optimize collection, review and system setup while delivering the requirements to stakeholders and customers.
Identifies and develops areas for improvement in data management processes, standards and tools.
May lead continuous improvement special projects, or any other data management tasks deemed appropriate by management.
Mentor and train staff as needed.

Education/Experience
B.A. or B.S. degree, preferably in life sciences, computer science, or related discipline AND 5 years’ experience in Clinical Data Management in the Pharmaceutical industry.

OR
10 Years' experience in End to End Clinical Data Management Trial Design, Build and Execution.

Knowledge And Skills
Knowledge of the clinical development process, on the therapy area of interest and on how to translate Protocol requirements into data management specifications.
Expert knowledge of end to end clinical data management and the impact to downstream consumers.
Excellent analytical and creative problem solving, critical thinking, conflict resolution, communication, organizational, and multi-tasking skills.
Innovative mindset.
Strong understanding of CDISC/Study Data Tabulation Model (SDTM) and corresponding implementation guides, CDISC terminologies and the related regulations for submission deliverables.
Process oriented with Quality Assurance/Quality Control prior experience.
Ability to work under pressure in a changing environment.
Understanding of data management systems and tools and their interactions.
Demonstrated leadership and collaboration skills to establish good working relationship within internal teams and external stakeholders.
Ability to be flexible and work independently.
Open to new learning opportunities to improve the way we work.

We are a research-driven biopharmaceutical company. Our mission is built on the simple premise that if we “follow the science” that great medicines can make a significant impact to our world. We believe that a research-driven enterprise dedicated to world-class science can succeed by inventing medicine and vaccine innovations that make a difference for patients across the globe.

Who We Are …

We are known as Merck & Co., Inc., Kenilworth, New Jersey, USA in the United States and Canada and MSD everywhere else. For more than a century, we have been inventing for life, bringing forward medicines and vaccines for many of the world's most challenging diseases. Today, our company continues to be at the forefront of research to deliver innovative health solutions and advance the prevention and treatment of diseases that threaten people and animals around the world.

What We Look For …

In a world of rapid innovation, we seek brave Inventors who want to make an Impact in all aspects of our business, enabling breakthroughs that will affect generations to come. We encourage you to bring your disruptive thinking, collaborative spirit and diverse perspective to our organization. Together we will continue Inventing For Life, Impacting Lives while Inspiring Your Career Growth.

INVENT.

IMPACT.

INSPIRE.

NOTICE FOR INTERNAL APPLICANTS

In accordance with Managers' Policy - Job Posting and Employee Placement, all employees subject to this policy are required to have a minimum of twelve (12) months of service in current position prior to applying for open positions.

If you have been offered a separation benefits package, but have not yet reached your separation date and are offered a position within the salary and geographical parameters as set forth in the Summary Plan Description (SPD) of your separation package, then you are no longer eligible for your separation benefits package. To discuss in more detail, please contact your HRBP or Talent Acquisition Advisor.

US And Puerto Rico Residents Only

If you need an accommodation for the application process please email us at staffingaadar@msd.com
For more information about personal rights under Equal Employment Opportunity, visit:

EEOC Poster

EEOC GINA Supplement

OFCCP EEO Supplement

OFCCP Pay Transparency Rule

We are an equal opportunity employer, Minority/Female/Disability/Veteran – proudly embracing diversity in all of its manifestations.

Search Firm Representatives Please Read Carefully
Merck & Co., Inc., Kenilworth, NJ, USA, also known as Merck Sharp & Dohme Corp., Kenilworth, NJ, USA, does not accept unsolicited assistance from search firms for employment opportunities. All CVs / resumes submitted by search firms to any employee at our company without a valid written search agreement in place for this position will be deemed the sole property of our company. No fee will be paid in the event a candidate is hired by our company as a result of an agency referral where no pre-existing agreement is in place. Where agency agreements are in place, introductions are position specific. Please, no phone calls or emails.

Employee Status

Regular

Relocation:
No relocation

VISA Sponsorship

No

Travel Requirements

No Travel Required

Flexible Work Arrangements

Flex Time, Remote Work

Shift

1st - Day

Valid Driving License

No

Number Of Openings

Hazardous Material(s):

4

Requisition ID:R78649"
31	2265927055	MSL - Inflamación e Inmunología	Pfizer	Buenos Aires, Provincia de Buenos Aires, Argentina	Hace 6 días	 No corresponde	 Jornada completa	 Otro	 Industria farmacéutica	"Pfizer es la compañía biofarmacéutica líder, cuyo propósito es innovar para cambiar la vida de los pacientes. Creemos que es nuestra gente y cultura lo que hoy nos da la ventaja competitiva más grande en el mercado.

La innovación comienza al desafiar las convencionalidades, especialmente ante la incertidumbre o la adversidad, y ello ocurre cuando pensamos en grande, nos expresamos y somos decididos.

Cambiamos la vida de los pacientes cuando damos lo mejor al trabajar juntos, por ello nos enfocamos en lo que importa, acordamos quién hace qué y medimos el progreso.

Para Pfizer es primordial que todos los colegas se sientan escuchados, acompañados y cuidados. Esto sucede cuando somos inclusivos, actuamos con integridad y reducimos la disparidad en el sistema de salud.

Nos dedicamos a nuestro trabajo y él también se entrega a nosotros; encontramos alegría cuando estamos orgullosos, nos reconocemos y nos divertimos.

Hoy te invitamos a vivir con nosotros el propósito de Innovar para Cambiar la vida de los pacientes con Coraje, Excelencia, Equidad, y Alegría.

En esta oportunidad buscamos sumar a nuestro equipo médico un MSL para la línea de Inflamación & Inmunología

Te invitamos a leer la descripción del cargo completa y postularte si te interesa y cumples con los requisitos

PURPOSE

Medical scientific liaison (MSL) programs are expanding in today’s pharmaceutical industry. MSLs are therapeutic specialists with advanced scientific training and degrees in life sciences (careers related to sciences such as medicine, biology, pharmacy, etc). Majority of MSLs currently in industry are physicians without an advanced scientific degree but with an excellent scientific aptitude which is critical to productive interactions between MSLs and thought KOLs who are research pioneers and authorities in the rheumatology field.

MSL programs have an integral place in the life-cycle development of a product within the rheumatology area.

Prominent field-based medical programs are implemented in most pharmaceutical companies. Many companies also employ MSLs as key sources of contact with specialist for a therapeutic area. Besides, some pharmaceutical companies implement MSL programs before the establishment of formal sales forces, particularly those companies with products still in clinical trials and not yet commercially available. This is very important in the case of Pfizer taking into account the forthcoming products in the oncology area which are in development (phase II and III). This underscores the primary role of a MSL to secure the company’s presence in the therapeutic market, and reinforces a demand for growth in field-based medical programs.

MAIN REPONSIBILITIES /

Foster collaborative relationships with opinion leaders and facilitate the exchange of unbiased scientific information between the medical community and the company

Promote scientific information of key molecule among targeted physicians Develop and maintain professional relationships with academic centers to ensure their access to current medical and scientific information.

Conduct technical presentations to ensure accessibility of scientific information and to aware physicians with the latest information in the oncology area

Participates in medical educational programs and disseminates technical information regarding the molecule and disease concepts, identifying competitive advantages.

Provide scientific information of the latest clinical trials showing the develop, efficacy and safety on the use of the newproduct

Work closely with medical manager and the cluster lead to:
Develop and maintain strong relationships with Physicians , in accordance with the strategies developed by Medical to further understand and gain both insight and/or input into treatment patterns, and unmet medical needs in an unsolicited form
Provide information to local experts to assist in keeping their presentations current and ensure they have medical and scientific information necessary when responding to questions encountered during their presentations
Serve as local medical scientific resource planning for communication of product information

Attend scientific meetings, reviews scientific journals and partners with Medical Manager and BUM to foster information on medical concepts and product usage.

Required Skills

Education & Experience
Physician Degree Preferred: dermatologist or internist with experience in pharma industry

Desired technical and behavioral skills:
Full time dedication
Strong scientific and pharmaceutical knowledge
Experience in the industry (not exclusion criteria).
Excellent communications and organizational skills
Ability to build and develop customer relationships
Ability to lead and influence key decision makers
Excellent presentation skills
Entrepreneurial drive 0
Proficient in Microsoft tools
English knowledge.

En Pfizer tenemos el objetivo de ser tan diversos como los pacientes y las comunidades a las que servimos, a través de una cultura vibrante y enriquecida por la mezcla de nacionalidades, identidades, edades, géneros, experiencias, tradiciones & capacidades. Estamos comprometidos con atraer Talento basándonos en las habilidades y experiencias imprescindibles para realizar el trabajo.

Si te interesa sumarte a Pfizer, envíanos tu solicitud sin agregar foto, edad, estado civil o cualquier otra información que consideres innecesaria para la posición que estás aplicando.

Traé tu auténtico ser al trabajo - Bring your authentic self to work –

Pfizer is an equal opportunity employer and complies with all applicable equal employment opportunity legislation in each jurisdiction in which it operates.

Medical"
32	2249331563	Coordinador de Automatización	Randstad Argentina	Pilar, Provincia de Buenos Aires, Argentina	Hace 4 días	 Intermedio	 Jornada completa	 Otro Ingeniería Producción	 Industria farmacéutica	"Nuestro cliente, Importante Multinacional del Rubro Farmacéutico, necesita incorporar un Coordinador de Automatización, para trabajar en su planta en Pilar.

Será el responsable de:
Llevar adelante tareas de coordinación, contratación de servicios, compra de repuestos para:
Mantenimiento preventivo y correctivo
Soporte a producción con fallas y mejoras de procesos

El candidato ideal deberá ser:
Graduado de carreras de Ingeniería electrónica o eléctrica
Sólida experiencia en Plantas industriales de manufactura, en áreas de mantenimiento/producción, preferentemente en industria Farmacéutica o Alimenticia

Capacidades técnicas requeridas:
Capacidad de análisis de fallas, enfocado en la mejora continua.
Interpretación de planos.
Programación de PLC, digitalización y redes de control.
Conocimiento de dispositivos eléctricos de BT y MT, tableros, CCM, selectividad de protecciones, celdas, eficiencia energética.
Idioma Ingles intermedio/avanzado Excluyente.
 Buscamos una persona con vocación de trabajo en equipo, comunicación fluida y honesta, muy proactivo, innovador, abierto a los cambios para incorporarse en un equipo interdisciplinario y en constante crecimiento en búsqueda de la excelencia operacional y soluciones tecnológicas de punta.

Entrarás a formar parte de una compañía líder en su sector con excelentes condiciones de contratación y posibilidad de desarrollo de carrera!  Si crees que cumplís con los requisitos, te estamos esperando!!!"
33	2308829669	Talent Acquisition Partner	Novo Nordisk	Partido de San Vicente, Provincia de Buenos Aires, Argentina	Hace 3 días	 No corresponde	 Jornada completa	 Otro	 Industria farmacéutica	"Are you ready for a life-changing career at Novo Nordisk?

Working at Novo Nordisk is never just a job, it is an opportunity to have a life-changing career – you grow professionally and you impact the lives of our patients for better. We are looking for a Talent Acquisition Partner to support two affiliates in Region LATAM, Argentina and Chile & Perú.

About The Department

Anchored in our Global Talent Acquisition Centre of Excellence (Global TA CoE), our high-performing TA team consists of 5 dedicated TA professionals. Being anchored in the Global TA CoE under ‘TA International’, means that you will join a global team of functional subject matter experts in the area of TA and will therefore be able to tap into global TA best practice, which you will then be able to apply locally in Argentina, Chile & Perú. The position will be located in our office in Vicente López, Buenos Aires.

Argentina affiliate is located in Buenos Aires with approx. 150 employees. Chile & Perú affiliate has offices in Santiago de Chile and Lima, Perú with approx. 90 employees.

Together we are driving change with the aim of defeating diabetes and other serious chronic diseases such as obesity and rare blood and metabolic disorders.

The position

As our TA Partner for Argentina, Chile & Perú, you will be responsible for recruitments at all levels, which will give you the opportunity to collaborate with colleagues and business leaders across functions. You will be the TA subject matter expert, advising our hiring managers in all matters related to recruitment. You will be responsible for understanding the talent needs of the business and converting them into effective talent strategies. You will be also responsible for articulating all the activities between all stakeholders involved in the recruitment process, including Sourcer and Administrative. In addition, you will be responsible for facilitating the recruitment process by conducting candidate assessments and business cases when applicable. Ultimately, you will be responsible for delivering smooth and professional candidate and hiring manager experience during the entire recruitment process.

You will also be driving the Employer Branding activities in Argentina, Chile & Perú to ensure that Novo Nordisk is a preferred company to work for. You will be responsible for implementing innovative digital recruitment practices by using various social media platforms. You will also have a role to play in other TA related activities such us graduate recruitment activities.

As Talent Acquisition Partner, you will report to the Head of Talent Acquisition LATAM. You should expect some travel throughout the year in order to ensure a good coverage and collaboration with both affiliates.

Qualifications
You have minimum 4 years of experience from a similar TA role in a global company.
You have a bachelor’s degree within HR or a related field.
Fluency in English & Spanish is a must, and you have strong communication and presentation skills.
Experience with Employer Branding and effective usage of social media platforms.
Experience from an RPO (Recruitment Process Outsourced) supported recruitment delivery model is an advantage.
As a person you are ambitious, proactive and have strong stakeholder and project management skills with a proven track record of influencing with an inclusive style and ability to interact effectively with stakeholders at all levels, while you contribute to build a healthy work environment within the team, sharing perspectives and helping others.


Deadline to apply: November 26th, 2020

Millions rely on us
To work for Novo Nordisk you will need the skills, dedication and ambition to change lives for the better for millions of patients living with diabetes and other chronic diseases. In exchange, we offer the chance to be part of a truly global workplace, where passion and engagement are met with opportunities for professional and personal development."
34	2269470904	Marketing Director	Teva Pharmaceuticals	Buenos Aires, Provincia de Buenos Aires, Argentina	Hace 5 días	 Director	 Jornada completa	 Marketing Ventas	 Sanidad, bienestar y ejercicio Biotecnología Industria farmacéutica	"Información de la Compañía

Teva es un líder farmacéutico global y el mayor productor mundial de medicamentos genéricos, comprometido con mejorar la salud y aumentar el acceso a soluciones de salud de calidad en todo el mundo. Nuestros empleados son el centro de nuestro éxito, con colegas en más de 80 países entregando el botiquín más grande del mundo a 200 millones de personas todos los días. Ofrecemos un portafolio único y diversidad de productos y soluciones para pacientes y hemos creado un canal centrado en nuestras principales áreas terapéuticas. Continuamente desarrollamos soluciones centradas en el paciente y hacemos crecer significativamente tanto nuestro negocio de medicamentos genéricos como medicamentos especializados a través de la inversión en investigación y desarrollo, marketing, desarrollo comercial e innovación. Así es como mejoramos la salud y permitimos que las personas vivan vidas mejores y más saludables. ¡Únete a nosotros en nuestro viaje de crecimiento!

Requerimientos Básicos
Lic. en Marketing, Lic en Comercialización, Lic. En Administración de Empresas, Médico, Ingeniero, Farmacéutico (Profesional conocimientos Industria Farmacéutica y Marketing).
Experiencia mínima de 2 años en posición similar.
Conocimientos técnicos especializados: Circuito Comercial, Mercado farmacéutico, Documentación y registro de medicamentos, Marco regulatorio, Sistema de Salud (Obras Sociales, Prepagas y Sindicales).
Inglés avanzado.


Responsabilidades y Funciones
Definir y diseñar la estrategia de marketing y promoción para los productos de la compañía, supervisando su implementación y el cumplimento de los objetivos comerciales (Mix de productos, estrategias de precios y productos en promoción, costos de comercialización y promoción, etc.).
Detectar espacios para la expansión del potencial comercial de los productos bajo su cargo, para contribuir al crecimiento de la participación en el mercado.
Administrar las marcas comerciales y los aspectos relacionados bajo la ley de patentes, con la asesoría legal correspondiente.
Detectar oportunidades de negocio, identificando planes de marketing para el portfolio futuro de productos.
Asegurar el cumplimiento de todas las normativas regulatorias que rigen las interacciones comerciales con los profesionales de la salud, los pagadores, organismos y socios comerciales.
Actuar en un marco ético y de Compliance, erigiéndose en un modelo de líder que guíe a sus Colaboradores.
Liderar, desarrollar y gestionar a los Colaboradores del equipo a su cargo, tanto del área de Marketing como de Promoción.

Reportara al GM de Argentina y Uruguay.

Función

Marketing

Sub función

Brand Marketing

Reporta a

In process of validation

Ya trabajando en Teva?

Si eres un empleado actual de Teva, por favor aplica usando el portal interno de ""Employee Central"". De este modo tu aplicación se tramitará con preferencia. Además, podrás ver las oportunidades que sean abiertas exclusivamente para los empleados de Teva. Pulsa en el siguiente enlace para buscar y aplicar: Internal Career Site

Portal de carrera interno está disponible en tu red doméstica. Si tienes dificultades para acceder a tu cuenta de EC, contacta con tu RRHH/ IT locales.

Igualdad de Oportunidades en Teva

Teva Pharmaceuticals se compromete con la igualdad de oportunidades en el empleo. La política global de Teva es ofrecer igualdad de oportunidades de empleo sin distinción de edad, raza, credo, color, religión, sexo, discapacidad, embarazo, condición médica, orientación sexual, identidad o expresión de género, ascendencia, origen nacional o étnico o cualquier otro estado legalmente reconocido con derecho a protección bajo las leyes aplicables.

Teva Pharmaceuticals is committed to equal opportunity in employment. It is Teva's policy that equal employment opportunity be provided without regard to age, race, creed, color, religion, sex, disability, pregnancy, medical condition, genetic information, marital status, sexual orientation, gender identity or expression, ancestry, national or ethnic origin, citizenship status, military status or status as a disabled or protected veteran, or any legally recognized status entitled to protection under applicable federal, state, or local laws."
