	Id	Titulo	Compañia	Lugar	Fecha	Nivel de antigüedad	Tipo de empleo	Función laboral	Sectores	Contenido
26	2306738444	Clinical Trial Manager	Bristol Myers Squibb	Buenos Aires, Provincia de Buenos Aires, Argentina	Hace 4 días	 Algo de responsabilidad	 Jornada completa	 Investigación Análisis Tecnología de la información	 Servicios y tecnologías de la información Atención sanitaria y hospitalaria Industria farmacéutica	"En Bristol Myers Squibb, nos inspira una sola visión transformar la vida de los pacientes a través de la ciencia. En oncología, hematología, inmunología y enfermedades cardiovasculares, y una de las líneas de producción más diversas y prometedoras de la industria, cada uno de nuestros apasionados compañeros contribuye a innovaciones que impulsan cambios significativos. Aportamos un toque humano a cada tratamiento en el que somos pioneros. Únete a nosotros y marca la diferencia.

Coordinates country cross functional teams and acts as the main point of contact for a Country with the protocol manager and other global study team members
Coordinates with other internal roles in country and site feasibility process, including proposal and validation of country study targets
Develops country level patient recruitment strategy & risk mitigation. Coordinates and ensures country level study enrolment targets and timelines are met
Leads problem solving and resolution efforts including management of risk, contingencies, issue resolution and escalation to the appropriate stakeholder/s
Assessment and set up the of vendors during study start up period (locally)
Investigator Meeting participation and preparation
Ensures data entered in Clinical Trial Managements Systems is current and complete and access to eDC and vendor systems is available for the Country and clinical trial site personnel
Validation of study related materials (i.e. protocol, ICF, patient material)
Responsible for preparing country specific documents (e.g. global country specific amendment)
Prepares materials for Site Initiation Visits
Responsible for verifying and confirming with local team eTMF completeness (Country and Site level)
Reviews Site Monitoring visit reports, takes action within the timelines specified and escalates issues and ensures appropriate documentation of issues.
Coordination of database locks and query follow up. Ensures timelines are met.
Ensure inspection readiness of assigned trials within country. Provide support to Health Authority inspection and pre-inspection activities
Coordinates, develops and writes the Corrective Actions / Preventive Actions (CAPA) and ensures implementation for Country audit level findings. Drives CAPA review, implementation and completion.
Lead study team meetings locally
Reviewing and approving payments (based on GOA) and manage patient compensation claims (if applicable)
Management of Site relationships (includes CRO related issues)
May conduct Pre-Study Evaluation Visits (PSEVs) and Site Initiation Visits (SIVs)
May perform site closure activities, including post-close out
May act as point of contact for Sites
May support preparing submissions to and obtaining approval from local Health Authorities, Ethics Committees and other relevant instances
The responsibilities listed above are only a summary and other responsibilities will be requirements as assigned

Degree/Experience Requirements Bachelors or Master’s degree required. Field of study within life sciences or equivalent. Experience as Clinical Trial Manager Minimum of 4 years' industry related experience, Experience in leading or participating as an active member of cross functional teams, task forces, or local and global initiatives. Thorough understanding of GCP, ICH Guidelines and Country regulatory environment, in depth knowledge of clinical research processes, regulations and methodology, understands clinical landscape with practical knowledge of a variety of medical settings and medical records management, Strong organization and time management skills, Ability of critical thinking and risk analysis. Skilled in the use of technology. Good verbal and written communication skills (both in English and local language).

En todo el mundo, nos apasiona tener un impacto en la vida de los pacientes con enfermedades graves. Con el poder de aplicar nuestros talentos individuales y perspectivas diversas en una cultura inclusiva, nuestros valores compartidos de pasión, innovación, urgencia, responsabilidad, inclusión e integridad sacan a relucir el mayor potencial de cada uno de nuestros colegas.

Bristol Myers Squibb reconoce la importancia del equilibrio y la flexibilidad en nuestro entorno de trabajo. Ofrecemos una amplia variedad de beneficios, servicios y programas competitivos que brindan a nuestros empleados los recursos para perseguir sus metas, tanto en el trabajo como en su vida personal."
27	2311686461	Medical Director - Oncology (Remote)	Clinipace	Buenos Aires, Provincia de Buenos Aires, Argentina	Hace 7 horas	 Director	 Jornada completa	 Atención médica	 Biotecnología Industria farmacéutica Investigación	"Job Title: Medical Director - Oncology (home based / remote)

Job Location: Morrisville, NC

Job Overview

This remote, home-based position provides and exciting opportunity to combine a diverse range of medical monitoring duties with support for corporate Business Development activities.

Due to broad scope of this role, successful candidate will demonstrate excellent clinical thinking, communication and leadership skills. Medical Director will be expected to attend and present at professional and internal and external project meetings..

Detailed Description Below

Primary responsibilities include medical and safety oversight of clinical trials as well as corporate support for business opportunities. The Medical Director provides Medical Monitoring services to clinical trials with the aim to monitor the safety and well being of study participants, integrity of the project data in accordance with the clinical trial protocol/clinical study protocol (or equivalent documents), standard operating procedures (SOPs), good clinical practice (GCP), and all other applicable directives and regulatory requirements. Responsibilities include medical supervision of assigned projects from both a medical and scientific perspective. The Medical Director provides and/or oversees medical monitoring activities including protocol development, development and/or review of project-specific Medical Monitoring Plan (MMP), review of other project-specific plans, responding to medically related questions, answering Medical questions arising at any stage of a clinical trial, and maintaining medical oversight for the conduct of a clinical trial. Reviews of medical data and/or safety information may be a regular part of the position. The Medical Director acts as liaison between the Sponsor/Client who is responsible for medical decisions made in a project, the investigational sites and the project team. To perform functions, he/she may need to be available up to 24 hours / 7 days a week. Scope of responsibilities of the Medical Director depends on the contract with each Sponsor. The Medical Director also supports Business Development activities, as requested.

Job Duties And Responsibilities

Job duties differ from project to project and are described in the contract, project-specific Plans (SMP; MMP), and/or other documents agreed with the Sponsor. Job duties also comprise any other tasks as defined by applicable Policies/SOPs/Work Procedures (WPs) and in general include but are not limited to the following:
Medical Monitoring:
Provides Medical oversight of projects to ensure GCP/national and international regulatory requirements (as applicable), Policies/SOPs/WPs, and Sponsor directives are followed.
Provides Medical consultation to Sponsors and project teams for protocol development and/or project activities, as indicated.
Maintains availability to the sites and project team including the Sponsor to ensure that medical questions or medical aspects of project-related questions (e.g. safety, general protocol questions, subject eligibility, inclusion/exclusion criteria, screening, randomization, unblinding, dosing, termination and discontinuation, IP-specific questions, etc.) are answered or communicated for resolution. The MM does not instruct the site how to manage a patient from the medical/clinical prospective but advises how to understand the protocol and other applicable project requirements.
Develops/updates the Medical Monitoring Plan (MMP), circulating it for approval within Clinipace and externally (with Sponsor); maintaining the MMP up-to date at all times during the project, escalating deviations from the MMP.
Reviews project specific plans, including the Safety Management Plan (SMP).
Reviews and advises on project-related documents (e.g. study protocol, Informed Consent Form, clinical study report, etc.), as indicated.
Develops and/or reviews project-related documents and reports, assesses and interprets project results.
Reviews medical literature in the scope of preparation of project-related documents and provides input for preparation of the respective documents.
Reviews and assesses issues related to protocol compliance, including protocol deviations/violations, development of the corrective and preventative actions.
Trains CRAs and other team members on different topics, including medical and/or safety aspects of the project or therapeutic area/indication.
May provide training to other medical monitors.
Attends internal and external project meetings (e.g. Investigator meeting, Kick-off meeting, teleconferences, etc.).
Attends data review meetings (interim analysis and final data analysis), as indicated.
May participate in dose escalation meetings for early phase studies.
May attend and provide review of documents for DSMB meetings.
Reviews laboratory results and lab/ECG alerts, as required.
Provides Medical review and assessment of SAEs, adverse events of special interest, SAE narratives, expedited and periodic safety reports, as requested.
Prepares Analysis of Similar Events for expedited safety reports.
May write Medical sections of periodic safety reports (e.g., risk-benefit assessments) and/or review safety data for trends.
Provides Medical review of study data (presented e.g. in the format of listings, patient profiles, visual analytic templates, etc.), as per the MMP/Medical data review plan for clarifying and resolving data inconsistencies, query management, trend assessment, etc.
May perform Medical review of coding to ensure correct MedDRA/WHODrug coding.
May review requests from Regulatory Authorities and/or Ethic Committees/IRBs and related activities with preparation of responses, when requested.
Ensures appropriate safety considerations have been incorporated into the Clinical Event Committee (CEC) process, if requested.
Escalates issues and notifies Line Manager, Project Manager, and/or other responsible staff if urgent safety issues are identified.
Provides availability (to sites, Sponsors, project teams) via call-in number up to 24 hours / 7 days a week or other schedule, as needed.
Documents all communication (interactions with sites, Sponsor, etc.) and provides for filing in the TMF, as required.
Works closely with other functional groups and departments including but not limited to Safety/Pharmacovigilance, Project Management, Clinical Operations, Data Management, Biostatistics and QA to ensure that medical operational functions are executed effectively as per contract.
Other tasks and responsibilities, as requested.
Business Development Support (as needed):
May work with Feasibility to identify potential sites for a project; review feasibility questionnaires; and/or discuss capabilities by e-mail or phone.
May attend professional meetings, serve as a speaker, and/or assist with Business Development efforts.
Attends capability and bid defense meetings, as needed, to provide medical and scientific advice for potential new projects.
Supports Business Development by preparing protocol considerations for new Proposals, answering Requests for Information, etc., as requested.


Supervisory Responsibilities

Medical Director may act as Line Manager, if indicated. In case more than two Medical Monitors are assigned to the project, one MM may by Primary MM, assuming more responsibilities e.g. communication with the Client and other functions. Details of the split of responsibilities are described in the MMP.

Job Requirements
Education
MD (or country-specific equivalent) required, postgraduate training/eligibility for licensure preferred.
Experience
At least 5-10 years of experience research experience post-training. Clinical Research Organization (CRO) experience is strongly preferred.
Must have prior Oncology experience.
Prior experience across the spectrum of Medical Monitoring activities, including Medical review of safety information.
Prior experience working in multiple therapeutic areas and across Phase 1 to 3 clinical trials is preferred.
Prior experience in development and delivery of therapeutic area/protocol-specific trainings and presentations.
Experience representing the company in meetings with pharmaceutical/biotechnology companies is preferred.
Skills/Competencies
Clinical thinking: ability to perform critical review and answer questions of medical nature from sites, project team, and Sponsor in accordance with ICH GCP guidelines, project specific documents to ensure patient safety, data integrity and successful completion of project.
Deep understanding of the scientific basis for therapies and drug-induced diseases.
Comprehensive knowledge of medical device, vaccines and drug development process.
High level understanding of pharmacovigilance processes.
Effective communication: comfortable communicating both inside and outside to company.
Management with a calm, positive winning attitude and excellent decision making skills.
Strong knowledge of the drug/device/vaccine development process.
Extensive knowledge of GCP/applicable regulations and guidance’s, including but not limited to national/regional regulations as well as ICH Guidances.
Training expertise: able to efficiently train others.
People management: able to clearly and efficiently communicate with site and team members.
Clinical Management: able to manage clinical projects successfully.
Time management: good sense of urgency, prioritization skills.
Team player: effective participant as a team member and team leader.
Creative and positive leadership: programming team success through establishing and clear articulation of goals.
Creative problem solving skills.
Effective oral and written communication and presentation skills (at least in English) are compulsory.
Coach: a passion to assist others in becoming all they can be; Achievements: ability to define and meet requirements.
Integrity: Understanding and acting on principles of honesty, trust and fairness.
Capabilities
Proficient in the use of computers and Microsoft Office applications.
Ability to drive an automobile and have a valid driver’s license.
Ability to travel by airplane.
Must have a credit card that can be used for travel expenses.
Ability to work remotely.
Ability to travel up to 20%, as needed.


The company will not accept unsolicited resumes from third party vendors."
28	2302261878	Farmaceutico Adjunto | Con esperiencia titulado	Carella & Co	Buenos Aires, Provincia de Buenos Aires, Argentina	Hace 1 mes	 Sin experiencia	 Jornada completa	 Atención médica	 Biotecnología Atención sanitaria y hospitalaria Industria farmacéutica	"Requisitos

Farmaceutico ,edad entre 25 y 40 años,con experiencia en Farmacia, atención al público y laboratorio

Actividades a Realizar

Atención al público y laboratorio,tareas generales de farmacia,control y expendio de medicamentos y artículos de perfumería

Ofrecemos

Agradable ambiente de trabajo"
29	2234244711	Foreign Trade & Customer Service Manager	Seqirus	Argentina	Hace 2 semanas	 Intermedio	 Jornada completa	 Atención al cliente Tecnología de la información	 Industria farmacéutica Biotecnología	"Come join a company that tackles fascinating problems and find solutions to complex challenges. With deep expertise in influenza science, our team works on cutting-edge research, pioneering technologies to optimise the manufacturing process and improve the effectiveness of influenza vaccines. We operate as one integrated global organisation, drawing together expert staff from different countries to collaborate. Together, we are working on the front line to protect communities from seasonal influenza and global pandemic threats. When you join Seqirus, you join a team dedicated to making a difference in people's lives. It's a feeling of possibility, creativity, and purpose that inspires us every day.



This position leads all foreign trade and L ogistics for LatAm. It also is the unique cross-functional project manager for LatAm, responsible for PAHO tender coordination, new product launch readiness from the Operational point of view. Leads Operational Excellence for LatAm.



Principal Responsibilities:



LatAm Foreign Trade Manager



Set up, source and manage Foreign Trade department for LatAm.
End to End responsibilities for all foreign trade activities of Seqirus LatAm, Importation and Exportation.
Front person before Customs officers accross LatAm.
Understanding tariff positions and impact in Flu vaccines business: taxes and access to tenders.
To drive contracts, documentary and logistics requirements to comply with Customs regulations in all Countries Seqirus operates.
To manage foreign trade activities and relationships with clients and Seqirus sites.

Customer Service Excellence Manager



To lead logistics set-up for each LatAm market.
To drive timely communication and alignment among internal and external clients by being the main POC.
To understand documentary requirements in each release stage for each LatAm market/customer.
To track and manage local activities from shipment arrival to local batch release to market.
To anticipate changes to plans. To assess and propose alternatives solutions.
To manage any query, comment, complaint, suggestion in relation to logistics and quality activities.

LatAm Project Management



To lead end-to-end new Operations related projects such as new products introductions, PAHO tenders, geo expansion projects, etc.
To lead, align and engage all necessary cross-functional global areas to guarantee milestones are timely fulfilled.
To keep stakeholders formally and frequently updated on project milestones status and next steps.

Operations Excellence



To lead Operations planning processes for LatAm.
To be responsible to collect lessons learnt (CCI Program), communicate to Global and lead corrective action within LatAm
Develop and implement SOPs required for LatAm operations.
To work across Latam market, manufacturing sites, functional roles and new enterprise business processes to create common continuous improvement methodologies for Seqirus LatAm.



Qualifications
:

Bachelor degree or equivalent in business, communications or related discipline
5-7 years' experience in customer service or related field
Microsoft Office and strong Excel skills required
SAP, Model N, and experience in the pharmaceutical, biotech or healthcare industry preferred



Different qualifications or responsibilities may apply based on local legal and/or educational requirements. Refer to local job documentation where applicable.



LI-TD1 #Seqirus"
